{"$schema":"https://json-schema.org/draft/2020-12/schema","$id":"https://stagnes307.github.io/study/factory/schemas/progress.schema.json","title":"Ailey Study Factory Progress","type":"object","required":["version","course_id","updated","lessons"],"properties":{"version":{"const":1},"course_id":{"type":"string"},"updated":{"type":"string","format":"date-time"},"lessons":{"type":"object","additionalProperties":{"type":"object","required":["status","ff","cc","url","last_error"],"properties":{"status":{"enum":["pending","ff-running","ff-complete","cc-running","cc-complete","publishing","published","failed"]},"ff":{"type":"boolean"},"cc":{"type":"boolean"},"url":{"type":["string","null"]},"last_error":{"type":["string","null"]}}}}}}
