{
  "version": 1,
  "course_id": "quality-management-engineer-practical",
  "updated": "2026-08-28T19:01:46+09:00",
  "lessons": {
    "1-1-1-1": {
      "status": "published",
      "ff": true,
      "cc": true,
      "url": "/study/courses/quality-management-engineer-practical/lessons/1-1-1-1-quality-information-framework/",
      "last_error": null
    },
    "1-1-2-1": {
      "status": "published",
      "ff": true,
      "cc": true,
      "url": "/study/courses/quality-management-engineer-practical/lessons/1-1-2-1-quality-data-collection-analysis/",
      "last_error": null
    },
    "1-1-2-2": {
      "status": "published",
      "ff": true,
      "cc": true,
      "url": "/study/courses/quality-management-engineer-practical/lessons/1-1-2-2-quality-information-evaluation-decisions/",
      "last_error": null
    },
    "1-1-3-1": {
      "status": "published",
      "ff": true,
      "cc": true,
      "url": "/study/courses/quality-management-engineer-practical/lessons/1-1-3-1-statistical-quality-information-use/",
      "last_error": null
    },
    "1-2-1-1": {
      "status": "published",
      "ff": true,
      "cc": true,
      "url": "/study/courses/quality-management-engineer-practical/lessons/1-2-1-1-quality-cost-framework/",
      "last_error": null
    },
    "1-2-2-1": {
      "status": "published",
      "ff": true,
      "cc": true,
      "url": "/study/courses/quality-management-engineer-practical/lessons/1-2-2-1-quality-cost-collection-validation/",
      "last_error": null
    },
    "1-2-3-1": {
      "status": "published",
      "ff": true,
      "cc": true,
      "url": "/study/courses/quality-management-engineer-practical/lessons/1-2-3-1-quality-cost-improvement-monitoring/",
      "last_error": null
    },
    "1-3-1-1": {
      "status": "published",
      "ff": true,
      "cc": true,
      "url": "/study/courses/quality-management-engineer-practical/lessons/1-3-1-1-quality-variables-experiment-setup/",
      "last_error": null
    },
    "1-3-2-1": {
      "status": "published",
      "ff": true,
      "cc": true,
      "url": "/study/courses/quality-management-engineer-practical/lessons/1-3-2-1-parameter-design-execution/",
      "last_error": null
    },
    "1-3-2-2": {
      "status": "published",
      "ff": true,
      "cc": true,
      "url": "/study/courses/quality-management-engineer-practical/lessons/1-3-2-2-parameter-design-results-optimization/",
      "last_error": null
    },
    "1-3-3-1": {
      "status": "published",
      "ff": true,
      "cc": true,
      "url": "/study/courses/quality-management-engineer-practical/lessons/1-3-3-1-tolerance-design-anova/",
      "last_error": null
    },
    "1-4-1-1": {
      "status": "published",
      "ff": true,
      "cc": true,
      "url": "/study/courses/quality-management-engineer-practical/lessons/1-4-1-1-critical-control-item-selection/",
      "last_error": null
    },
    "1-4-2-1": {
      "status": "published",
      "ff": true,
      "cc": true,
      "url": "/study/courses/quality-management-engineer-practical/lessons/1-4-2-1-control-chart-selection-construction/",
      "last_error": null
    },
    "1-4-2-2": {
      "status": "published",
      "ff": true,
      "cc": true,
      "url": "/study/courses/quality-management-engineer-practical/lessons/1-4-2-2-control-chart-interpretation-response/",
      "last_error": null
    },
    "1-4-3-1": {
      "status": "published",
      "ff": true,
      "cc": true,
      "url": "/study/courses/quality-management-engineer-practical/lessons/1-4-3-1-process-capability-method-evaluation/",
      "last_error": null
    },
    "1-4-3-2": {
      "status": "published",
      "ff": true,
      "cc": true,
      "url": "/study/courses/quality-management-engineer-practical/lessons/1-4-3-2-process-capability-improvement/",
      "last_error": null
    },
    "1-5-1-1": {
      "status": "published",
      "ff": true,
      "cc": true,
      "url": "/study/courses/quality-management-engineer-practical/lessons/1-5-1-1-inspection-system-planning/",
      "last_error": null
    },
    "1-5-2-1": {
      "status": "published",
      "ff": true,
      "cc": true,
      "url": "/study/courses/quality-management-engineer-practical/lessons/1-5-2-1-lot-inspection-nonconformance-records/",
      "last_error": null
    },
    "1-5-3-1": {
      "status": "published",
      "ff": true,
      "cc": true,
      "url": "/study/courses/quality-management-engineer-practical/lessons/1-5-3-1-measurement-equipment-calibration-msa/",
      "last_error": null
    },
    "1-6-1-1": {
      "status": "published",
      "ff": true,
      "cc": true,
      "url": "/study/courses/quality-management-engineer-practical/lessons/1-6-1-1-quality-assurance-process-standards/",
      "last_error": null
    },
    "1-6-2-1": {
      "status": "published",
      "ff": true,
      "cc": true,
      "url": "/study/courses/quality-management-engineer-practical/lessons/1-6-2-1-quality-assurance-training-support/",
      "last_error": null
    },
    "1-6-2-2": {
      "status": "published",
      "ff": true,
      "cc": true,
      "url": "/study/courses/quality-management-engineer-practical/lessons/1-6-2-2-quality-assurance-operation-follow-up/",
      "last_error": null
    },
    "1-7-1-1": {
      "status": "published",
      "ff": true,
      "cc": true,
      "url": "/study/courses/quality-management-engineer-practical/lessons/1-7-1-1-reliability-process-standards/",
      "last_error": null
    },
    "1-7-2-1": {
      "status": "published",
      "ff": true,
      "cc": true,
      "url": "/study/courses/quality-management-engineer-practical/lessons/1-7-2-1-reliability-verification-planning-execution/",
      "last_error": null
    },
    "1-7-2-2": {
      "status": "published",
      "ff": true,
      "cc": true,
      "url": "/study/courses/quality-management-engineer-practical/lessons/1-7-2-2-reliability-verification-results-improvement/",
      "last_error": null
    },
    "1-7-3-1": {
      "status": "published",
      "ff": true,
      "cc": true,
      "url": "/study/courses/quality-management-engineer-practical/lessons/1-7-3-1-reliability-parameter-analysis/",
      "last_error": null
    },
    "1-7-3-2": {
      "status": "published",
      "ff": true,
      "cc": true,
      "url": "/study/courses/quality-management-engineer-practical/lessons/1-7-3-2-reliability-evaluation-improvement/",
      "last_error": null
    },
    "1-8-1-1": {
      "status": "published",
      "ff": true,
      "cc": true,
      "url": "/study/courses/quality-management-engineer-practical/lessons/1-8-1-1-right-item-quantity-location-five-s/",
      "last_error": null
    },
    "1-8-2-1": {
      "status": "published",
      "ff": true,
      "cc": true,
      "url": "/study/courses/quality-management-engineer-practical/lessons/1-8-2-1-visual-management-activities/",
      "last_error": null
    },
    "1-8-3-1": {
      "status": "published",
      "ff": true,
      "cc": true,
      "url": "/study/courses/quality-management-engineer-practical/lessons/1-8-3-1-autonomous-maintenance-activities/",
      "last_error": null
    }
  }
}
